{
  "version": "0.1",
  "run_id": "run_b758f141d4",
  "scenario_id": "regime_stress_v0",
  "metrics": {
    "tasks_completed": 4,
    "task_latency_ms_p50": 8.580972055904894,
    "task_latency_ms_p95": 13.741772289424727,
    "task_latency_ms_p99": 13.99374154154231,
    "coordination_messages": 4,
    "tasks_completed_after_fault": null,
    "steps_to_completion_after_first_fault": null
  },
  "faults": {
    "fault_injected": false,
    "fault_events": [],
    "recovery_ok": true
  },
  "notes": "Thin-slice MAESTRO report; semantics will expand in v0.2+"
}
